paper_id,title,authors,year,venue,abstract,url,decision,reason
35771af00810,Efficient workflow scheduling algorithm for cloud computing system: a dynamic priority-based approach,"I Gupta, MS Kumar, PK Jana",2018.0,Arabian Journal for Science and …,"heterogeneous cloud computing environment. In this paper, we propose a workflow scheduling   new dynamic priority list-based workflow scheduling algorithm for heterogeneous cloud.",https://link.springer.com/article/10.1007/s13369-018-3261-8,include,"obj=False, wl=True"
c67ae3efd53d,Combinatorial metaheuristic methods to optimize the scheduling of scientific workflows in green DVFS-enabled edge-cloud computing,"MI Khaleel, M Safran, S Alfarhood, D Gupta",2024.0,Alexandria Engineering …,"A significant challenge in high-performance computing is to ensure the even distribution of  applications across computational resources, preventing issues such as resource",https://www.sciencedirect.com/science/article/pii/S1110016823010827,include,"obj=False, wl=True"
cbdd474b7a14,An efficient load balancing technique for task scheduling in heterogeneous cloud environment,"H Mahmoud, M Thabet, MH Khafagy, FA Omara",2021.0,Cluster Computing,[29] have proposed an energy and resource-efficient workflow scheduling algorithm called  ERES to schedule workflow tasks to VMs. Workflow scheduler consists of a workflow analyzer,https://link.springer.com/article/10.1007/s10586-021-03334-z,include,"obj=True, wl=True"
5255829da745,Network reconfiguration algorithm (NRA) for scheduling communication-intensive graphs in heterogeneous computing environment,"A Masood, S Gulzar Ahmad, H Ullah Khan",2020.0,Cluster …,"Recently, a workflow scheduling problem is addressed in [31 Considering the heterogeneity  in multiple aspects, the  fewer heterogeneity aspect of the high performance computing",https://link.springer.com/article/10.1007/s10586-019-03002-3,include,"obj=False, wl=True"
7a3836260a81,Scheduling constrained cloud workflow tasks via evolutionary multitasking optimization with adaptive knowledge transfer,"J Zhou, L Gao, S Rao, Y Li",2024.0,IEEE Transactions on Services …,usually processed at high performance computing infrastructure  constrained multi-workflow  scheduling from the viewpoint of  multi-workflow on heterogeneous distributed computation,https://ieeexplore.ieee.org/abstract/document/10682808/,include,"obj=False, wl=True"
e103e2d49acd,Replication and data management-based workflow scheduling algorithm for multi-cloud data centre platform,"Z Ulabedin, B Nazir",2021.0,The Journal of Supercomputing,"Scientific workflow applications require high-performance computing resources and huge   With these advantages, research on workflow scheduling has shifted from grid to cloud",https://link.springer.com/article/10.1007/s11227-020-03541-2,include,"obj=False, wl=True"
84466d785838,A hybrid multi-objective metaheuristic optimization algorithm for scientific workflow scheduling,"A Mohammadzadeh, M Masdari, FS Gharehchopogh",2021.0,Cluster …,"to find dominant responses using Pareto for heterogeneous environments. Bi-objective Dynamic   applications, limited priority in heterogeneous distributed systems like cloud computing",https://link.springer.com/article/10.1007/s10586-020-03205-z,include,"obj=False, wl=True"
6bc91bdfad24,MOTORS: multi-objective task offloading and resource scheduling algorithm for heterogeneous fog-cloud computing scenario,"P Shukla, S Pandey",2024.0,The Journal of Supercomputing,that demand for more high-performance computing capabilities.  We describe the workflow  scheduling method in this section. It  We handle the workflow scheduling problem as a multi-,https://link.springer.com/article/10.1007/s11227-024-06315-2,include,"obj=False, wl=True"
8399ed171582,Evolutionary multi-objective workflow scheduling for volatile resources in the cloud,"TP Pham, T Fahringer",2020.0,IEEE Transactions on Cloud …,Many workflow scheduling algorithms have been proposed  multi-objective workflow  scheduling approach to generate a  multi-objective workflow scheduling algorithm is competitive in,https://ieeexplore.ieee.org/abstract/document/9090348/,include,"obj=False, wl=True"
8dc80589eec6,Cost-effective workflow scheduling approach on cloud under deadline constraint using firefly algorithm,"KK Chakravarthi, L Shyamala, V Vaidehi",2021.0,Applied Intelligence,"Third, there is a limitation in traditional heterogeneous environments with respect to the   resource provisioning and workflow scheduling algorithms. Workflow scheduling is widely known",https://link.springer.com/article/10.1007/s10489-020-01875-1,include,"obj=True, wl=True"
5ea100f9361e,Computation of workflow scheduling using backpropagation neural network in cloud computing: a virtual machine placement approach,"N Raman, AB Wahab, S Chandrasekaran",2021.0,The Journal of …,"For measuring the efficiency of workflow scheduling, determining makespan and execution   , designing an efficient computation of workflow scheduling remains a challenge. The Cloud",https://link.springer.com/article/10.1007/s11227-021-03648-0,include,"obj=True, wl=True"
7f343de470d0,Task Characterization-Based Energy-Aware Scheduling Algorithm in Heterogeneous Computing Systems,"Y Lu, J Wu, J Lu, W Hu, D Jiang",2025.0,International Conference on Intelligent …,"meet the requirements of high-performance computing, multi-core  workflow scheduling length  problem for heterogeneous  to minimize the workflow scheduling length for heterogeneous",https://link.springer.com/chapter/10.1007/978-981-96-9961-2_40,include,"obj=True, wl=True"
0678746e5585,Heterogeneity-aware resource allocation in HPC systems,"A Netti, C Galleguillos, Z Kiziltan, A Sîrbu",2018.0,… Performance Computing,"heterogeneity-aware resource allocation becomes crucial for heterogeneous HPC systems.   describes the Eurora HPC system, its workload datasets, and the scheduling algorithms we",https://link.springer.com/chapter/10.1007/978-3-319-92040-5_1,include,"obj=False, wl=True"
5eb99651aa2b,Advanced Resource Allocation in the Context of Heterogeneous Workflows Management,"F Lubrano, C Vercellino, G Vitali, P Viviani",2024.0,Proceedings of the 2nd …,"Optimal resource allocation becomes of paramount importance to keep the performance   engine and a batch scheduler to make (optimal) resource allocation simple, by means of an on-",https://dl.acm.org/doi/abs/10.1145/3642978.3652835,include,"obj=False, wl=True"
48e2e1e3d9d1,Real-time workload prediction and resource optimization for parallel heterogeneous high-performance computing systems architectures,"A Aslam, ZD Anuarovna",2025.0,Ubiquitous Technology Journal,"resource management framework for heterogeneous parallel architectures that efficiently  addresses the challenges of task scheduling, resource allocation, and energy optimization in",https://crosslinkstudies.com/ubicc/index.php/utj/article/view/11,include,"obj=True, wl=True"
e3ce3075693e,A Graph-based Deep Reinforcement Learning Model for Task Scheduling on Heterogeneous Resource-Elastic Management of Resource Pool,"C Zhang, F Wu, Z Wang, X Wang",2025.0,IEEE Transactions on …,"Then, we design a dynamic resource allocation strategy model based on deep reinforcement  learning (DRL) to reduce job processing time. Finally, we compare the performance of our",https://ieeexplore.ieee.org/abstract/document/11202232/,include,"obj=False, wl=True"
402be47a13a3,A framework for heterogeneous resource allocation in sensor-cloud environment,"S Bose, D Sarkar, N Mukherjee",2019.0,Wireless Personal Communications,only for immediate resource allocation. Our  scheduling algorithms for resources in an  optimized way to minimize operational cost and maximize sensor lifetime with the heterogeneous,https://link.springer.com/article/10.1007/s11277-019-06383-1,include,"obj=True, wl=False"
71138d144feb,An integrated optimization-based algorithm for energy efficiency and resource allocation in heterogeneous cloud computing centers,"KY Tai, FYS Lin, CH Hsiao",2023.0,Ieee Access,"heterogeneous computing resources, reducing energy consumption, and providing task  scheduling and execution time in heterogeneous  computing resource allocation and scheduling",https://ieeexplore.ieee.org/abstract/document/10138402/,include,"obj=True, wl=False"
7760e9985cfc,Multi-agent deep reinforcement learning-based resource allocation in hpc/ai converged cluster,"J Narantuya, JS Shin, S Park, JW Kim",2022.0,nan,There are several existing works on resource allocation and job scheduling in HPC/AI   They used the heterogeneous distributed deep learning (HDDL) model to schedule multiple jobs,https://scholar.gist.ac.kr/handle/local/10866,include,"obj=False, wl=True"
9a391b2b5a34,Scalable management of heterogeneous cloud resources based on evolution strategies algorithm,"P Loncar, P Loncar",2022.0,IEEE access,This research focuses on scheduling tasks and processing scientific data in a heterogeneous   was examined in [38] as a job scheduling policy to solve the resource allocation and task,https://ieeexplore.ieee.org/abstract/document/9805748/,include,"obj=False, wl=True"
0f337c3544a1,Optimizing HPC scheduling: a hierarchical reinforcement learning approach for intelligent job selection and allocation: L. Wang et al.,"L Wang, MA Rodriguez, N Lipovetzky",2025.0,The Journal of Supercomputing,"and resource allocation, particularly in dynamic and heterogeneous HPC environments. In   optimizes job selection and resource allocation through hierarchical reinforcement learning.",https://link.springer.com/article/10.1007/s11227-025-07396-3,include,"obj=False, wl=True"
20ca91cfaf0a,Multi-criteria HPC task scheduling on IaaS cloud infrastructures using meta-heuristics,"A Chhabra, G Singh, KS Kahlon",2021.0,Cluster Computing,"is a known NP-Hard problem due to heterogeneous workloads and computing resources,   scheduling policies presented in this section, which could optimize only resource allocation",https://link.springer.com/article/10.1007/s10586-020-03168-1,include,"obj=False, wl=True"
539c9e79333d,Dynamic tasks scheduling with multiple priorities on heterogeneous computing systems,"H Tayeb, B Bramas, M Faverge",2024.0,2024 IEEE …,"efficient resource allocation in our scheduling algorithm, ultimately taking full advantage of  all available heterogeneous resources to optimize the overall performance of the application.",https://ieeexplore.ieee.org/abstract/document/10596474/,include,"obj=False, wl=True"
8a365f656187,"Orchestrated co-scheduling, resource partitioning, and power capping on CPU-GPU heterogeneous systems via machine learning","I Saba, E Arima, D Liu, M Schulz",2022.0,International Conference on Architecture …,"simply pick the first element that represents the number of core or GPC allocation to the first  job (\(\mathrm {J_1}\)), and then divide it by the maximum number of the resource allocation (",https://link.springer.com/chapter/10.1007/978-3-031-21867-5_4,include,"obj=False, wl=True"
026e0faff95c,Towards OS Heterogeneity Aware Cluster Management for HPC,"Z An, D Li, Y Guo, G Gao, Y Ren, N Jia",2023.0,Proceedings of the 14th …,of introducing heterogeneity awareness into the whole cluster scheduling workflow. We   existing cluster scheduler to realize the optimal resource allocation under heterogeneous OSes.,https://dl.acm.org/doi/abs/10.1145/3609510.3609819,include,"obj=False, wl=True"
88b1921c89b7,Optimal job scheduling with resource packing for heterogeneous servers,"H Xu, Y Liu, WC Lau",2021.0,IEEE/ACM Transactions on Networking,"In this paper, we consider the problem of job scheduling for a computing cluster comprised  of multiple servers with heterogeneous  In addition, the two resource allocation variables zi",https://ieeexplore.ieee.org/abstract/document/9393492/,include,"obj=False, wl=True"
5be615bfc968,Performance Optimization of HPC Workloads in Cloud Using AI-Driven Algorithms,"A Iftekhar, R Mishra",2025.0,Asian Symposium on Programming Languages and …,scheduling becomes critical. Conventional schedulers such as FCFS or SJF often struggle to  adapt to the heterogeneous  -based scheduler that improves resource allocation efficiency.,https://link.springer.com/chapter/10.1007/978-981-95-3585-9_13,include,"obj=False, wl=True"
fd749c6b6cd9,… : A Graph Neural Network and Reinforcement Learning Framework for Constraint and Data-Aware Workflow Mapping and Scheduling in Heterogeneous HPC …,"AK Sharma, J Kunkel",2025.0,arXiv preprint arXiv:2506.00260,for practical HPC mapping and scheduling applications.  resource allocation within an  HPC-CC context. Our automated procedure for workload assignment and scheduling in the HPC-,https://arxiv.org/abs/2506.00260,include,"obj=False, wl=True"
18dd8e893a31,An Intelligent Approach to Resource Allocation on Heterogeneous Cloud Infrastructures,"J Marquez, OH Mondragon, JD Gonzalez",2021.0,Applied Sciences,"algorithm that selects a heterogeneous storage device (SSD or HDD) to execute each task,  based on certain probabilities. This algorithm solves a workload scheduling problem that is",https://www.mdpi.com/2076-3417/11/21/9940,include,"obj=False, wl=True"
b9ea5ac6accb,Efficient configuration of heterogeneous resources and task scheduling strategies in deep learning auto-tuning systems,"PY Ken, CC Wu",2025.0,The Journal of Supercomputing,"First, we propose an Automatic Heterogeneous Resource Allocation Strategy, which  dynamically adapts resource distribution based on Node configurations, optimizing utilization while",https://link.springer.com/article/10.1007/s11227-025-07798-3,include,"obj=True, wl=False"
2df977473932,HARMONIC: Uncertainty-Aware Multi-Objective Optimization for Energy-Efficient HPC Resource Management,"KC Adimora, H Sun",2025.0,IEEE Transactions on Parallel and …,"develop confidenceaware resource allocation strategies that  We represent the HPC  environment as a heterogeneous  of job scheduling decisions, including resource allocation, job",https://ieeexplore.ieee.org/abstract/document/11165096/,include,"obj=True, wl=True"
1d21c49da7a1,Efficient Multi-Cluster Scheduling for Heterogeneous Workloads,"X Wang, X Li, X Xia, M Yang",2025.0,IEEE Access,"for effective cross-cluster scheduling in heterogeneous environments. Consequently, they  often encounter issues such as inefficient task-to-resource allocation, suboptimal resource",https://ieeexplore.ieee.org/abstract/document/11222093/,include,"obj=False, wl=True"
d97fc667cf2d,Energy-saving scheduling on IaaS HPC cloud environments based on a multi-objective genetic algorithm.,"S Vila, F Guirado, JL Lerida",2019.0,Journal of …,"However, in this environment, the inherent resources heterogeneity, the virtual machine  ,  on dynamic scheduling the task arrival is uncertain at run time and the resource allocation must",https://search.ebscohost.com/login.aspx?direct=true&profile=ehost&scope=site&authtype=crawler&jrnl=09208542&AN=135780620&h=D%2Fec9BbKYY9n4ChHpOPSe73%2BwXddFGI1QUKOSooCVHPNpfnFepENQ2D%2FVv46i91ftj9MQlpyOJmq%2BO7jnR9aHA%3D%3D&crl=c,include,"obj=True, wl=False"
fe91f3ac52a8,A scalable and adaptable allocation framework for heterogeneous resources in a large cluster environment,"C Filelis‐Papadopoulos, H Xiong",2021.0,Concurrency and …,re-examination of the resource allocation problem by proposing a framework to support  distributed resource allocation decisions and that  Optimal job scheduling is an NP-hard problem.,https://onlinelibrary.wiley.com/doi/abs/10.1002/cpe.5564,include,"obj=False, wl=True"
