paper_id,title,authors,year,venue,abstract,url,decision,reason
7140d6922e6b,Reliability/performance-aware scheduling for parallel applications with energy constraints on heterogeneous computing systems,"J Peng, K Li, J Chen, K Li",2022.0,IEEE Transactions on Sustainable …,"respectively, which are widely used in high-performance computing systems [29]. In addition,   workflow scheduling algorithm on heterogeneous systems,” IEEE Trans. Ind. Inform., vol.",https://ieeexplore.ieee.org/abstract/document/9695188/,include,"obj=True, wl=True"
22fff180f1b2,DE-GWO: a multi-objective workflow scheduling algorithm for heterogeneous fog-cloud environment,"P Shukla, S Pandey",2024.0,Arabian Journal for Science and Engineering,were mostly deployed on High Performance Computing (HPC) platforms [ heterogeneous  FCE which includes mapping of tasks constituting workflows onto the available heterogeneous,https://link.springer.com/article/10.1007/s13369-023-08425-0,include,"obj=False, wl=True"
a00b9a97b29c,CPTF–a new heuristic based branch and bound algorithm for workflow scheduling in heterogeneous distributed computing systems,"D Sirisha, SS Prasad",2024.0,CCF Transactions on High Performance Computing,computation requirements and necessitate Heterogeneous Distributed Computing Systems  ( First (CPTF) algorithm is proposed for workflow scheduling on HDCS to achieve the best,https://link.springer.com/article/10.1007/s42514-024-00192-0,include,"obj=False, wl=True"
7c8693e6b06c,Energy and resource efficient workflow scheduling in a virtualized cloud environment,"N Garg, D Singh, MS Goraya",2021.0,Cluster Computing,"Most of workflow scheduling algorithms have focused on  The selection of an efficient and  effective workflow scheduling  , dynamic provisioning of unlimited heterogeneous resources is",https://link.springer.com/article/10.1007/s10586-020-03149-4,include,"obj=True, wl=True"
7d6d8acdb656,Energy efficient workflow scheduling algorithm for latency-sensitive applications using cloud-fog collaboration,"P Shukla, S Pandey",2023.0,2023 IEEE International Conference on …,") for optimizing workflow scheduling in heterogeneous CFC.  demand for more high  performance computing capabilities. So,  at hand is to optimize the workflow scheduling in",https://ieeexplore.ieee.org/abstract/document/10469573/,include,"obj=True, wl=True"
4ca268b6a653,Scheduling workflows with composite tasks: A nested particle swarm optimization approach,"A Song, WN Chen, X Luo, ZH Zhan",2020.0,IEEE Transactions on …,"a novel model for WorkFlow Scheduling, which models heavy  when scheduling high-performance  computing applications  the heterogeneous processors, the Heterogeneous Earliest-",https://ieeexplore.ieee.org/abstract/document/9007494/,include,"obj=False, wl=True"
6e8cca345bf4,Hybrid meta-heuristic genetic algorithm: Differential evolution algorithms for scientific workflow scheduling in heterogeneous cloud environment,"FA Saif, R Latip, MN Derahman, AA Alwan",2022.0,Proceedings of the future …,This research aims to investigate how heterogeneous cloud computing affects workflow  scheduling is more proper for executing workflow scheduling in heterogeneous cloud computing.,https://link.springer.com/chapter/10.1007/978-3-031-18344-7_2,include,"obj=False, wl=True"
81802f55dd3c,Scheduling beyond CPUs for HPC,"Y Fan, Z Lan, P Rich, WE Allcock, ME Papka",2019.0,Proceedings of the 28th …,The exponential growth in computing power has enabled highperformance computing (HPC  ]; Jakob et al. formulated a workflow scheduling problem in grid into optimizing a weighted,https://dl.acm.org/doi/abs/10.1145/3307681.3325401,include,"obj=False, wl=True"
84c7ca0f59c3,Multi-tree genetic programming hyper-heuristic for dynamic flexible workflow scheduling in multi-clouds,"Z Sun, Y Mei, F Zhang, H Huang, C Gu",2024.0,IEEE Transactions on …,Multi-cloud is a promising paradigm due to its advantages such as avoiding vendor lock-in  and optimising costs. This article focuses on dynamic flexible workflow scheduling with,https://ieeexplore.ieee.org/abstract/document/10509784/,include,"obj=True, wl=True"
53f015f70641,MOHBA: multi-objective workflow scheduling in cloud computing using hybrid BAT algorithm,S Sobhanayak,2023.0,Computing,"systems and cloud computing high-performance computing is becoming more accessible to   for workflow scheduling in heterogeneous multiprocessors, Heterogeneous Earliest Finish",https://link.springer.com/article/10.1007/s00607-023-01175-9,include,"obj=False, wl=True"
b9381546dd19,Scientific workflow scheduling in multi-cloud computing using a hybrid multi-objective optimization algorithm,"A Mohammadzadeh, M Masdari",2023.0,Journal of Ambient Intelligence and …,"Scientists required a high-performance computing environment, such as cluster  computing,  This paper proposes a workflow scheduling algorithm for heterogeneous multi-cloud",https://link.springer.com/article/10.1007/s12652-021-03482-5,include,"obj=False, wl=True"
b24ae1028005,Efficient Probabilistic Workflow Scheduling for IaaS Clouds,"GR Russo, R Marotta, F Cordari, F Quaglia",2024.0,arXiv preprint arXiv …,"due to the greater complexity of the workflow scheduling problem in its  EPOSS, a novel  workflow scheduling algorithm for IaaS  size and number of heterogeneous virtual machine types",https://arxiv.org/abs/2412.06073,include,"obj=False, wl=True"
52a358957230,Dynamic multiworkflow deadline and budget constrained scheduling in heterogeneous distributed systems,"G Wang, Y Wang, MS Obaidat, C Lin",2021.0,IEEE Systems …,"the algorithm handles dynamic workflow scheduling on parallel heterogeneous resources,  we  His research interests include high-performance computing, computer architecture, and",https://ieeexplore.ieee.org/abstract/document/9464156/,include,"obj=True, wl=True"
a34b8ddf300e,An Enhanced Workflow Scheduling Algorithm for Cloud Computing Environment.,"S Ahmed, FA Omara",2022.0,International Journal of Intelligent Engineering & …,"Therefore, workflow scheduling is considered one of the most  Because the existing  heterogeneous earliest finish time (HEFT High performance computing (HPC) is the ability to",https://inass.org/wp-content/uploads/2022/09/2022123156-3.pdf,include,"obj=False, wl=True"
4bbdc003db5e,Multi-QoS constrained and profit-aware scheduling approach for concurrent workflows on heterogeneous systems,"H Arabnejad, JG Barbosa",2017.0,Future Generation Computer Systems,"presents a scheduling algorithm that manages concurrent workflows in a dynamic environment  in which jobs are submitted by users at any moment in time, on shared heterogeneous",https://www.sciencedirect.com/science/article/pii/S0167739X16303740,include,"obj=True, wl=True"
0b043d220823,Tri-Objective workflow scheduling and optimization in heterogeneous cloud environments,"H Alrammah, Y Gu, Z Liu",2020.0,2020 IEEE International Parallel and …,"In order to overcome both limitations, we propose a heuristic algorithm on workflow  scheduling in a cloud, called Multi-objective Optimization for Makespan, Cost and Energy (MOMCE),",https://ieeexplore.ieee.org/abstract/document/9150455/,include,"obj=True, wl=True"
be4647fcd832,Time effective workflow scheduling using genetic algorithm in cloud computing,"R Nagar, DK Gupta, RM Singh",2018.0,International Journal of Information …,implemented to make it usable on real life high performance computing setting. The   Authors proposed a list based scheduling technique named PEFT for heterogeneous distributed,https://www.academia.edu/download/96988453/IJITCS-V10-N1-8.pdf,include,"obj=False, wl=True"
a62d637071e0,An efficient resource utilization technique for scheduling scientific workload in cloud computing environment,"NP Sodinapalli, S Kulkarni, NA Sharief",2022.0,… Journal of Artificial …,"in the real time scenario for heterogeneous multi-core processing  In [17], [26] proposed two  resourceful workflow scheduling  Algorithms for High Performance Computing Applications.",https://search.proquest.com/openview/3bb0cde703adf7aa58af254422f9589a/1?pq-origsite=gscholar&cbl=1686339,include,"obj=True, wl=True"
ee260fccd82d,Cloud computing: a multi-workflow scheduling algorithm with dynamic reusability,"M Adhikari, S Koley",2018.0,Arabian Journal for Science and Engineering,"for propping up heterogeneous workflow applications to realize  are tailored on multi-workflow  scheduling exertion. These  distributed computing, high-performance computing as well as",https://link.springer.com/article/10.1007/s13369-017-2739-0,include,"obj=False, wl=True"
e102597d3e7d,Promoting Resource Utilization in HPC via Scheduling,"G Xian, Y Tan, J Yu, W Yang, B Li",2025.0,… and Computation: Practice …,"high-performance computing, offering novel insights into intelligent resource management.   [18] proposed a cloud workflow scheduling algorithm based on multi-objective reinforcement",https://onlinelibrary.wiley.com/doi/abs/10.1002/cpe.70385,include,"obj=True, wl=True"
b84df21cea8f,An HC-CSO Algorithm for Workflow Scheduling in Heterogeneous Cloud Computing System,"J Bhagwan, S Kumar",2021.0,International Journal of Advanced …,"technology via big storage facilities, high-performance computing, and other hardware and   The major aim of cloud computing technology is to provide high-performance computing",https://search.proquest.com/openview/45fba963c11c569fa83b4c346bdc6890/1?pq-origsite=gscholar&cbl=5444811,include,"obj=False, wl=True"
e6cae2008f77,Requirement-driven multi-workflow scheduling based on improved evolutionary multitasking embedded bi-level optimization,"M Li, L Wu, Y Zhang, X Cai",2025.0,Computer Communications,"When multiple users share the same cloud service resources, cloud computing makes it more  difficult for workflow applications to schedule tasks. Therefore, it is important to design an",https://www.sciencedirect.com/science/article/pii/S0140366425002919,include,"obj=False, wl=True"
0fe32093177e,Workflow scheduling in cloud environment using a novel metaheuristic optimization algorithm,A Ramathilagam,2021.0,International Journal of …,"up to 30% in execution time and up to 65% in data transfer time, while the High Performance  Computing (HPC) applications are processed in public clouds. This requirement is",https://onlinelibrary.wiley.com/doi/abs/10.1002/dac.4746,include,"obj=True, wl=True"
e9d384cb544c,Cost effective hybrid genetic algorithm for workflow scheduling in cloud,"SK Bothra, S Singhal, H Goyal",2022.0,System research and information …,for workflow scheduling in the cloud is a challenging area. We proposed a hybrid meta-heuristic  cost-effective load-balanced approach to schedule workflow in a heterogeneous,http://journal.iasa.kpi.ua/article/view/263013,include,"obj=True, wl=True"
e53268abf503,Cloud workflow scheduling algorithm based on reinforcement learning,"D Cui, Z Peng, W Ke, X Hong",2018.0,… Performance Computing …,"multiple DAGs with multiple priorities and improve utilisation rate of resources better and, on  the other hand, show optimisation object function achieves fair workflow scheduling in cloud",https://www.inderscienceonline.com/doi/abs/10.1504/IJHPCN.2018.091889,include,"obj=False, wl=True"
769a7e15a3f5,An online workflow scheduling algorithm considering license limitation in heterogeneous environment,"Q Qiao, L Chen, H Cai, H Zhang",2023.0,… : Practice and Experience,"the optimization of workflow scheduling on the cloud or high-performance computing (HPC)   learning 14, 15 to perform workflow scheduling, which have high computational complexity",https://onlinelibrary.wiley.com/doi/abs/10.1002/cpe.7452,include,"obj=False, wl=True"
9ea99463177c,Online multi-user workflow scheduling algorithm for fairness and energy optimization,"E Cadorel, H Coullon",2020.0,2020 20th IEEE/ACM …,"of scientific workflows are commonly heterogeneous in their libraries and  , high-performance  computing (HPC) and Grid computing have shown interest in scientific workflow scheduling",https://ieeexplore.ieee.org/abstract/document/9139740/,include,"obj=True, wl=True"
39bf56a88a08,Scheduling big data workflows in the cloud under deadline constraints,"M Ebrahimi, A Mohan, S Lu",2018.0,2018 IEEE Fourth International …,In Section III we explain our workflow scheduling algorithm in  highperformance workflow  scheduling in a heterogeneous cloud  with more existing workflow scheduling algorithms. In,https://ieeexplore.ieee.org/abstract/document/8405689/,include,"obj=True, wl=True"
7b4fbd3daed3,Two-Stage Workflow Scheduling Based on Deep Reinforcement Learning,"H Xu, H Zhang, J Wang, Y Wang, Y Guo",2024.0,EAI International …,"Thus, it offers a viable solution to the challenge of workflow scheduling in heterogeneous   -scale data processing and analysis, high-performance computing (HPC), artificial intelligence",https://link.springer.com/chapter/10.1007/978-3-031-93251-9_18,include,"obj=False, wl=True"
7e5e08eb7687,Hybrid JAYA algorithm for workflow scheduling in cloud,"SK Bothra, S Singhal, H Goyal",2023.0,Научно-технический вестник …,the load among virtual machines in a heterogeneous environment using JAYA approach. In  this  time during workflow scheduling. We considered the heterogeneous cloud computing,https://cyberleninka.ru/article/n/hybrid-jaya-algorithm-for-workflow-scheduling-in-cloud,include,"obj=False, wl=True"
4b7c66f37c32,A predictive energy consumption scheduling algorithm for multiprocessor heterogeneous system,"S Tian, W Ren, Q Deng, S Zou",2021.0,IEEE Transactions on …,"Multi-processor heterogeneous system has been widely used for handling parallel workflow  applications to advance the performance of system, in which efficient workflow scheduling",https://ieeexplore.ieee.org/abstract/document/9628181/,include,"obj=True, wl=True"
a80d1ad7928b,Reliability enhancement strategies for workflow scheduling under energy consumption constraints in clouds,"L Zhang, M Ai, K Liu, J Chen, K Li",2023.0,IEEE Transactions on …,reliability management solution for parallel workflow scheduling in the system to meet   workflow scheduling problem for parallel applications with priority constraints in heterogeneous,https://ieeexplore.ieee.org/abstract/document/10247559/,include,"obj=True, wl=True"
061f164f88e6,Performance and energy balanced algorithm for executing high performance computing application,SS Kulkarni,2019.0,… International Conference on Smart Systems and …,"-based data-intensive and scientific workflow scheduling [19], [20] method for executing High  performance computing (HPC)  high performance computing application on heterogeneous",https://ieeexplore.ieee.org/abstract/document/8987891/,include,"obj=True, wl=True"
6b9e67ad82b3,Energy-aware Scheduling of Workflow Applications Towards Schedule Length Optimization in Heterogeneous Distributed Embedded Systems,"J Chen, Q Zhang, P Han, Y Zhang, Y Lu",2025.0,ACM Transactions on …,"heterogeneous embedded systems, and this expansion is transforming traditional embedded  systems into heterogeneous  is a critical concern for heterogeneous distributed embedded",https://dl.acm.org/doi/abs/10.1145/3767164,include,"obj=True, wl=True"
f97d9cbbce1e,A heuristic approach for scheduling in heterogeneous distributed embedded systems,"S Prongnuch, S Sitjongsataporn",2020.0,International Journal of …,heuristic approach for workflow scheduling in heterogeneous distributed embedded system  ( and growth of the heterogeneous systems used for high-performance computing have been,http://www.inass.org/2020/2020022913.pdf,include,"obj=False, wl=True"
505549345266,Multi-objective workflow optimization strategy (MOWOS) for cloud computing,"JK Konjaang, L Xu",2021.0,Journal of Cloud Computing,"In this paper, we addressed the workflow scheduling  scientific workflows in heterogeneous  computing environments call  algorithm for scientific workflow scheduling in cloud known as",https://link.springer.com/article/10.1186/s13677-020-00219-1,include,"obj=False, wl=True"
9408c93b6b24,Energy efficient workflow scheduling in cloud computing systems using particle swarm optimization,"B Naik, P Kuila",2024.0,Proceedings of the International Conference on …,","" Cost and makespan aware workflow scheduling in iaas clouds  with multi-criteria for  highperformance computing systems: an  novel workflow scheduling for heterogeneous computing",https://books.google.com/books?hl=en&lr=&id=ozMmEQAAQBAJ&oi=fnd&pg=PA266&dq=%22workflow+scheduling%22+heterogeneous+%22high+performance+computing%22&ots=9MGf1mNWmb&sig=FyqAQySkXu1Po-JhYrUYJVALMnM,include,"obj=True, wl=True"
cc568703a383,Reliability and energy efficient workflow scheduling in cloud environment,"R Garg, M Mittal, LH Son",2019.0,Cluster Computing,popular workflow scheduling heuristics are: heterogeneous  two energy conscious workflow  scheduling algorithms using  efficient workflow scheduling (REEWS) in heterogeneous cloud,https://link.springer.com/article/10.1007/s10586-019-02911-7,include,"obj=True, wl=True"
aeb7dbd2787e,Ant colony optimization-based multi-objective task scheduling algorithm for supercomputing internet workflow,"P Fu, Z Wang, M Guo",2024.0,… on High Performance Computing and …,A workflow scheduling method based on improved particle swarm optimization algorithm is   and sorts each particle using a heterogeneous earliest completion time mapping method.,https://www.spiedigitallibrary.org/conference-proceedings-of-spie/13073/1307314/Ant-colony-optimization-based-multi-objective-task-scheduling-algorithm-for/10.1117/12.3026325.short,include,"obj=True, wl=True"
4a3b413310fd,Energy-aware task scheduling optimization with deep reinforcement learning for large-scale heterogeneous systems,"J Li, X Zhang, Z Wei, J Wei, Z Ji",2021.0,… on high performance computing,In high-performance computing centers or cloud data centers in different batches are  heterogeneous. Given the aforementioned  learning on heterogeneous resource management are,https://link.springer.com/article/10.1007/s42514-021-00083-8,include,"obj=True, wl=False"
24c80abf5e2b,An H-CSO Algorithm for Workflow Scheduling in Heterogeneous Cloud Environment.,"J Bhagwan, S Kumar",2021.0,International Journal of Intelligent Engineering & …,"Among these issues, workflow scheduling or resources mapping plays a significant role in  cloud resources performance. In workflows scheduling, the workflows tasks sent by a user are",https://inass.org/wp-content/uploads/2021/08/2021103137.pdf,include,"obj=False, wl=True"
139355ab555b,Deep Reinforcement Learning for Large-Scale Scientific Workflow Scheduling with Improved Structure Feature Extraction and Sampling,"X Qi, D Zhang, T Liu, H Wang",2024.0,IFIP International Conference on Network …,"for users to obtain high-performance computing resources. Under  heterogeneous earliest  finish time algorithm (HEFT) [10], which is a classic heuristic algorithm for workflow scheduling,",https://link.springer.com/chapter/10.1007/978-981-96-2830-8_24,include,"obj=False, wl=True"
4b508b5009eb,Lotaru: Locally estimating runtimes of scientific workflow tasks in heterogeneous clusters,"J Bader, F Lehmann, L Thamsen, J Will",2022.0,Proceedings of the 34th …,workflow scheduling algorithms need to be informed about task runtimes a-priori to conduct  efficient scheduling. In heterogeneous  in scientific workflows on heterogeneous clusters.,https://dl.acm.org/doi/abs/10.1145/3538712.3538739,include,"obj=False, wl=True"
a24241670445,"Bi-Objective Workflow Scheduling on Heterogeneous Computing Systems Using a Memetic Algorithm. Electronics 2021, 10, 209","Y Zhang, F Tong, C Li, Y Xu",2021.0,nan,"In practice, most HCSs are built for high performance computing. Thus, time efficiency is  almost always the first priority for workflow scheduling, even with additional considerations. In",https://search.proquest.com/openview/79b8738607b7b775b273ad7207f287b0/1?pq-origsite=gscholar&cbl=2032404,include,"obj=False, wl=True"
35fb6a455d55,On scheduling of high-throughput scientific workflows under budget constraints in multi-cloud environments,"R Li, CQ Wu, A Hou, Y Wang, T Gao",2018.0,2018 IEEE Intl Conf on …,We propose a heuristic streaming workflow scheduling algorithm (StreamWS) in a multi-  We plan to implement and test our workflow solution in production high-performance computing,https://ieeexplore.ieee.org/abstract/document/8672237/,include,"obj=True, wl=True"
fd3bd7bafb0e,Scheduling scientific workflow using multi-objective algorithm with fuzzy resource utilization in multi-cloud environment,"M Farid, R Latip, M Hussin, NAWA Hamid",2020.0,IEEE Access,thus require high-performance computing machines provided  This section discusses the  problem of workflow scheduling in  based constrained workflow scheduling for heterogeneous,https://ieeexplore.ieee.org/abstract/document/8976136/,include,"obj=True, wl=True"
a8a40c591042,Task clustering-based energy-aware workflow scheduling in cloud environment,"A Choudhary, MC Govil, G Singh",2018.0,… High Performance …,"CONCLUSION In this work, energy-aware Workflow scheduling algorithm has been  presented. In the Scientific applications, some of the task having minimum execution time merged",https://ieeexplore.ieee.org/abstract/document/8622898/,include,"obj=True, wl=True"
cd90bea46d5b,3OTSO: Three-Objective Task Scheduling Optimization for CPU-GPU Heterogeneous Cloud Environments,"Y Ma, G Wang, H Song, Y Tian, G Tan",2025.0,… on Internet of Things and Cloud …,With the rapid advancement of high-performance computing ap CPU-GPU-based  heterogeneous computing architectures as a crit Energy-aware scientific workflow scheduling in,https://dl.acm.org/doi/abs/10.1145/3776865.3776925,include,"obj=True, wl=True"
01fda0ecaa7d,An energy efficient algorithm for workflow scheduling in IAAS cloud,"V Singh, I Gupta, PK Jana",2020.0,Journal of Grid Computing,"a workflow scheduling algorithm that  workflow scheduling which is a combination of two  other existing algorithms namely, chemical reaction optimization (CRO) [18] and heterogeneous",https://link.springer.com/article/10.1007/S10723-019-09490-2,include,"obj=True, wl=True"
5bf2e97f1bbb,Hybrid Programming-based Scheduling Approach for Many Heterogeneous Computing Tasks with Asynchronous Generation in IIoT,"B Hu, R Zhong, Y Wang, T Wang",2025.0,IEEE Internet of …,"research domains, including high-performance computing [19],  privacy-aware multiworkflow  scheduling in hybrid clouds by  algorithm (DCME) for workflow scheduling in multi-cloud",https://ieeexplore.ieee.org/abstract/document/10988625/,include,"obj=False, wl=True"
5f232c1be503,A list-based heuristic algorithm for static task scheduling in heterogeneous distributed computing systems,"H Gholami, R Zakerian",2020.0,2020 6th international conference on …,The problem addressed in this study is the static scheduling of a task graph on heterogeneous   In Section II the related works on list-based scheduling algorithms for heterogeneous,https://ieeexplore.ieee.org/abstract/document/9122306/,include,"obj=False, wl=True"
c24d7c3fe071,A Full-Path Priority Based Workflow Scheduling Approach,"WC Tseng, KY Rong, KC Huang",2025.0,… on High Performance Computing in …,"Ge, “IPPTS: an efficient algorithm for scientific workflow scheduling in heterogeneous  computing systems,” IEEE Transactions on Parallel and Distributed Systems, pp. 1057–1071, 2021",https://dl.acm.org/doi/abs/10.1145/3712031.3712329,include,"obj=False, wl=True"
3fd03166a547,Automated workflow scheduling in self-adaptive clouds,"G Kousalya, P Balakrishnan, CP Raj",2017.0,nan,"There is a heightened heterogeneity of cloud IT resources,  crafted to describe the  various workflow scheduling algorithms and  Many high-performance computing and high-throughput",https://link.springer.com/content/pdf/10.1007/978-3-319-56982-6.pdf,include,"obj=True, wl=True"
6a2f9d08cc93,A novel scheduling with multi-criteria for high-performance computing systems: an improved genetic algorithm-based approach,"T Biswas, P Kuila, AK Ray",2019.0,Engineering with Computers,"A PSO-based workflow scheduling is also presented in [25] by considering two objectives,  ie We have assumed that a system consists of a set of p number of heterogeneous high-speed",https://link.springer.com/article/10.1007/s00366-018-0676-5,include,"obj=False, wl=True"
7527931014a4,k-Dispatch: Enabling Cost-Optimized Biomedical Workflow Offloading,"M Jaros, J Jaros",2024.0,Proceedings of the 33rd International Symposium on …,to remote high-performance computing clusters or cloud. In  Workflow scheduling is a  complex and challenging problem. The execution of many tasks on distributed and heterogeneous,https://dl.acm.org/doi/abs/10.1145/3625549.3658828,include,"obj=True, wl=True"
69553963aea2,Based on Multi-constraint Partitioning Multi-objective Workflow Scheduling Algorithm in Hybrid Clouds,"B WANG, Y LIN",2022.0,"UPB Sci. Bull., C","In this paper, a multi-objective optimal Heterogeneous workflow Scheduling based on  Multi-constraint ParTitioning algorithm (HSMPT) is proposed. The scheduling design considers a",https://www.scientificbulletin.upb.ro/rev_docs_arhiva/rez563_793727.pdf,include,"obj=False, wl=True"
d5f150e54a15,An energy-efficient task scheduling strategy based on improved fireworks algorithm in heterogeneous cloud,"H Zhao, F Meng, N Feng, Q Wang",2021.0,… on High Performance …,"Ismayilov, HR Topcuoglu, “Neural network based multi-objective evolutionary algorithm for  dynamic workflow scheduling in cloud computing,” in Future Generation Computer Systems,",https://ieeexplore.ieee.org/abstract/document/9781231/,include,"obj=True, wl=True"
